{
  "$schema": "https://horizunhub.com/schemas/project-context/v1",
  "schema_version": 1,
  "project": {
    "code": "DEMO",
    "name": "Demo office building",
    "location": "Demo city"
  },
  "appointment": {
    "role": "lead_appointed_party",
    "organisation_code": "ABC",
    "task_teams": [
      { "role_code": "A", "discipline": "architecture", "organisation": "ABC" },
      { "role_code": "S", "discipline": "structure", "organisation": "ABC" },
      { "role_code": "M", "discipline": "mechanical", "organisation": "ABC" }
    ],
    "stage": "4",
    "stage_scheme": "riba2020"
  },
  "documents": {
    "eir": { "path": "C:/proyectos/demo/00_docs/EIR.pdf", "status": "received", "version": "1.0", "date": "2026-01-15" },
    "bep": { "kind": "post_appointment", "path": "C:/proyectos/demo/00_docs/BEP.pdf", "status": "approved", "version": "2.0", "date": "2026-02-01" },
    "midp": { "path": "C:/proyectos/demo/00_docs/MIDP.xlsx", "status": "approved", "version": "1.0", "date": "2026-02-01" },
    "tidp": [
      { "task_team": "A", "path": "C:/proyectos/demo/00_docs/TIDP-A.xlsx", "status": "approved" },
      { "task_team": "S", "path": "C:/proyectos/demo/00_docs/TIDP-S.xlsx", "status": "approved" },
      { "task_team": "M", "path": "C:/proyectos/demo/00_docs/TIDP-M.xlsx", "status": "draft" }
    ],
    "responsibility_matrix": { "path": "C:/proyectos/demo/00_docs/responsibility-matrix.xlsx", "status": "approved" },
    "loin": { "status": "missing" },
    "ids": [
      { "path": "C:/proyectos/demo/00_docs/hz-delivery.ids", "applies_to": "mechanical", "status": "approved", "version": "1.0" }
    ]
  },
  "deliverables": [
    { "container": "DEMO-ABC-ZZ-XX-M3-A-0001", "task_team": "A", "due": "2026-10-30", "required_status": "S2", "format": "rvt", "milestone": "Stage 4 coordination" },
    { "container": "DEMO-ABC-ZZ-01-M3-M-0001", "task_team": "M", "due": "2026-10-30", "required_status": "S2", "format": "ifc", "milestone": "Stage 4 coordination" },
    { "container": "DEMO-ABC-ZZ-01-DR-A-0101", "task_team": "A", "due": "2026-11-15", "required_status": "A1", "format": "pdf", "milestone": "Stage 4 issue" }
  ],
  "cde": {
    "platform": "local",
    "root": "C:/proyectos/demo/cde",
    "states": { "wip": "01_WIP", "shared": "02_SHARED", "published": "03_PUBLISHED", "archived": "04_ARCHIVED" },
    "working_state": "wip",
    "approvals": {
      "wip_to_shared": "Task team lead",
      "shared_to_published": "Information manager",
      "published_to_archived": "Information manager"
    }
  },
  "naming": {
    "scheme": "iso19650-2",
    "separator": "-",
    "fields": [
      { "name": "project", "pattern": "^DEMO$" },
      { "name": "originator", "pattern": "^[A-Z]{3}$" },
      { "name": "volume", "pattern": "^[A-Z0-9]{2}$" },
      { "name": "level", "pattern": "^[A-Z0-9]{2}$" },
      { "name": "type", "pattern": "^[A-Z0-9]{2}$" },
      { "name": "role", "pattern": "^[A-Z]$" },
      { "name": "number", "pattern": "^[0-9]{4}$" }
    ],
    "status_codes": {
      "S0": "Work in progress",
      "S1": "Suitable for coordination",
      "S2": "Suitable for information",
      "S3": "Suitable for review and comment",
      "S4": "Suitable for stage approval",
      "A1": "Authorised and accepted",
      "B1": "Partially authorised",
      "CR": "As constructed record"
    },
    "revision": {
      "preliminary_pattern": "^P[0-9]{2}(\\.[0-9]{2})?$",
      "contractual_pattern": "^C[0-9]{2}$"
    }
  },
  "classification": {
    "system": "uniclass2015",
    "catalog_path": "C:/proyectos/demo/00_docs/uniclass2015-pr.xlsx",
    "type_parameter": "Classification.Uniclass.Pr.Number"
  },
  "georeference": {
    "crs": "EPSG:3857",
    "survey_point": { "n": 0, "e": 0, "z": 0, "angle_deg": 0 },
    "project_base_point": { "n": 0, "e": 0, "z": 0, "angle_deg": 0 },
    "true_north_deg": 0
  },
  "delivery": {
    "ifc": {
      "version": "IFC4",
      "mvd": "RV",
      "pset_mapping_path": "C:/proyectos/demo/00_docs/hz-delivery-psets.txt",
      "ids_paths": [ "C:/proyectos/demo/00_docs/hz-delivery.ids" ],
      "site_placement": "shared"
    },
    "sheets": { "format": "pdf", "naming": "iso19650-2" }
  },
  "software": { "revit_year": 2026 },
  "intake": {
    "completed_on": "2026-02-02",
    "missing": [],
    "assumptions": [ "Synthetic example: every name, code and path is a placeholder." ],
    "confirmed_by": "Information manager"
  }
}
